{
  "schemaVersion": "1",
  "id": "deskjoy",
  "name": "DeskJoy",
  "tagline": "Đồ decor và đồ chơi công nghệ cho dân văn phòng.",
  "currency": "VND",
  "locale": "vi-VN",
  "contact": {
    "phone": "0900000000",
    "email": "hello@example.com",
    "address": null
  },
  "social": {
    "facebook": null,
    "tiktok": null
  },
  "checkout": {
    "paymentMethods": [
      "cod",
      "bank_transfer"
    ],
    "shippingMethods": [
      {
        "id": "standard",
        "name": "Giao hàng tiêu chuẩn",
        "fee": 30000
      }
    ],
    "bankTransfer": {
      "bankName": "Example Bank",
      "accountName": "DESKJOY",
      "accountNumber": "0123456789",
      "transferNotePrefix": "DON"
    }
  }
}
